{
  "schema_version": "1.0.0",
  "app": {
    "title": "Thailand Travel Guide",
    "subtitle": "Complete Itinerary for Your Journey",
    "icon": "🇹🇭",
    "theme": {
      "primary": "#5BC0EB",
      "secondary": "#F5A9B8",
      "dark_mode": true
    },
    "date_range": {
      "start": "2026-04-21",
      "end": "2026-06-07"
    }
  },
  "features": {
    "diary": {
      "enabled": true,
      "storage": "local",
      "backend_url": null
    },
    "timer": {
      "enabled": true,
      "presets": [15, 30, 45, 60],
      "label": "Timer"
    },
    "phrasebook": {
      "enabled": true,
      "language": "Thai",
      "audio_path": "assets/audio/"
    }
  },
  "cards": [
    {
      "id": "cover",
      "type": "cover",
      "sort_index": 1,
      "title": "Thailand Travel Guide",
      "subtitle": "Complete Itinerary for Your Journey\n2026.04.21 — 2026.06.07",
      "icon": "🇹🇭"
    },
    {
      "id": "preparation",
      "type": "standard",
      "sort_index": 2,
      "date": "Before Departure",
      "title": "Preparation Checklist",
      "subtitle": "Everything You Need to Prepare",
      "sections": [
        {
          "type": "table",
          "title": "💰 Budget Preparation",
          "headers": ["Item", "Amount", "Method"],
          "rows": [
            ["Translation Fee", "6,000 THB", "Cash/Alipay"],
            ["Psychiatric Consultation", "3,950 THB", "Cash"],
            ["Daily Expenses", "15,000-20,000 THB", "Cash + Card"],
            ["Emergency Fund", "10,000 THB", "Cash"]
          ]
        },
        {
          "type": "info_box",
          "variant": "info",
          "title": "📌 Pre-departure Actions",
          "content": "Go to the bank to exchange enough Thai Baht → Confirm your bank card is enabled for international use → Confirm Alipay/WeChat is linked"
        },
        {
          "type": "checklist",
          "title": "📋 Document Checklist",
          "items": [
            "Passport (valid for 6+ months)",
            "Psychiatric doctor's certificate (original + 2 copies)",
            "Medical permission certificate (if applicable)",
            "Flight confirmation (printed + digital)",
            "Hotel booking confirmation (printed + digital)",
            "Clinic appointment confirmation",
            "Physical examination report",
            "Passport copies 2-3 copies (store separately)"
          ]
        },
        {
          "type": "expandable",
          "title": "Recommended Items to Bring",
          "content": "<ul><li><b>Disposable underwear (21+ pieces)</b>: Post-surgery you'll have tissue fluid and can't wash underwear yourself.</li><li><b>Lidocaine gel</b>: Essential for pain relief during dilation.</li><li><b>Lubricant applicator</b>: Keep extras, they're easy to lose.</li><li><b>Night pads/liquid sanitary pads</b>: Much more comfortable than regular pads.</li><li><b>Standing mirror with light</b>: For dilation and cleaning while in bed.</li><li><b>25mm pump head</b>: Attach to iodine bottle for easy dispensing.</li><li><b>Scissors</b>: For opening delivery food, pad packages.</li><li><b>O-shaped/U-shaped cushion</b>: <span class=\"highlight-danger\">【Life-saving】</span>Absolute must for flights and car rides to prevent wound pressure.</li></ul>"
        }
      ]
    },
    {
      "id": "day_1",
      "type": "standard",
      "sort_index": 3,
      "date": "Day 1",
      "title": "Flight Day",
      "subtitle": "Departure → Transit → Arrival",
      "sections": [
        {
          "type": "timeline",
          "items": [
            {
              "time": "05:00 Wake up",
              "content": "Simple breakfast (bread + milk), final check of passport/wallet/phone/power bank/neck pillow",
              "variant": "default"
            },
            {
              "time": "05:30 Depart",
              "content": "Take taxi to airport, approximately 45-60 minutes",
              "variant": "default"
            },
            {
              "time": "06:30 Arrive at airport",
              "content": "Check-in → Bag drop → Security check",
              "variant": "default"
            },
            {
              "time": "08:00 Flight departs",
              "content": "Flight approximately 2h40m. Air conditioning is cold, bring a jacket",
              "variant": "success"
            },
            {
              "time": "10:40 Arrive at transit",
              "content": "Follow Transfer signs, no need to go through immigration. Find next gate → restroom → wait",
              "variant": "default"
            },
            {
              "time": "12:00 Connecting flight",
              "content": "Flight approximately 3h. Note time difference: Thailand is 1 hour behind Beijing time",
              "variant": "success"
            },
            {
              "time": "14:00 Arrive at destination",
              "content": "Follow Arrivals → Immigration check. Purpose: 'Medical treatment'. How long: 'About 6 weeks'",
              "variant": "default"
            }
          ]
        },
        {
          "type": "info_box",
          "variant": "warning",
          "title": "⚠️ Immigration Tips",
          "content": "Stay calm, smile, keep answers concise. If language is a barrier, show your printed itinerary."
        }
      ]
    },
    {
      "id": "day_2",
      "type": "standard",
      "sort_index": 4,
      "date": "Day 2",
      "title": "Consultation Day",
      "subtitle": "Consultation · Examination · Documents",
      "sections": [
        {
          "type": "info_box",
          "variant": "success",
          "title": "💧 Morning Focus",
          "content": "<p>• <b>Eat a good breakfast + drink lots of water:</b> You'll need to do a urine test at the clinic!</p><p class=\"highlight\">⚠️ Before leaving, check your belongings:</p><ul><li><b>Passport original</b> (extremely important)</li><li><b>Psychiatric diagnosis certificate</b></li><li><b>Translation fee</b></li></ul>"
        },
        {
          "type": "timeline",
          "items": [
            {
              "time": "09:30 Consultation",
              "content": "Translator present. Doctor will ask about surgical expectations, health status, medication history. Physical examination and surgical plan discussion.",
              "variant": "default"
            },
            {
              "time": "After consultation",
              "content": "Blood test + urine test. Routine blood, coagulation, liver/kidney function, infectious disease screening",
              "variant": "default"
            },
            {
              "time": "Sign consent forms",
              "content": "Translator will explain each item. Ask questions if you have any doubts",
              "variant": "default"
            },
            {
              "time": "12:00 Psychiatric consultation",
              "content": "Two psychiatrists will interview you separately (about 30 minutes each). Confirm gender dysphoria diagnosis + surgical intent + psychological state",
              "variant": "default"
            },
            {
              "time": "14:00 Pre-surgery examination",
              "content": "Chest X-ray + other routine pre-surgery tests, approximately 1 hour",
              "variant": "default"
            },
            {
              "time": "15:00 Return to hotel",
              "content": "All tests normal → Report to family",
              "variant": "success"
            }
          ]
        }
      ]
    },
    {
      "id": "day_3",
      "type": "standard",
      "sort_index": 5,
      "date": "Day 3",
      "title": "Rest Day",
      "subtitle": "Final Preparation Before Surgery",
      "sections": [
        {
          "type": "info_box",
          "variant": "danger",
          "title": "🚫 Today's Diet Rules",
          "content": "<span class=\"highlight-danger\">Only eat light, easily digestible food:</span> Porridge (no meat), yogurt, jelly, juice<br><br><span class=\"highlight-danger\">Absolutely avoid:</span> Meat, fruits (with fiber), vegetables, any solid hard-to-digest food"
        },
        {
          "type": "info_box",
          "variant": "danger",
          "title": "⚠️ Critical Warning",
          "content": "If the first bowel movement after surgery is dry, it can easily cause severe tearing or heavy bleeding. <span class=\"highlight-danger\">Make sure to buy fiber supplements or aloe capsules in advance!</span>"
        }
      ]
    },
    {
      "id": "day_4",
      "type": "standard",
      "sort_index": 6,
      "date": "Day 4",
      "title": "Surgery Day",
      "subtitle": "Hospital",
      "sections": [
        {
          "type": "info_box",
          "variant": "danger",
          "title": "🚫 06:00 Absolute fasting",
          "content": "Cannot eat anything, cannot drink any water. Can rinse mouth but don't swallow. This is anesthesia safety requirement, must be strictly followed."
        },
        {
          "type": "timeline",
          "items": [
            {
              "time": "05:30 Wake up",
              "content": "Brush teeth (don't swallow water), use restroom, change into loose clothing",
              "variant": "default"
            },
            {
              "time": "07:00 Go to hospital",
              "content": "Bring passport and small backpack downstairs, driver takes you to hospital",
              "variant": "default"
            },
            {
              "time": "08:00 Arrive & register",
              "content": "Follow guide to registration, use appointment and passport, measure height and weight",
              "variant": "default"
            },
            {
              "time": "11:00 Enema",
              "content": "Nurse will perform enema to clear bowel again",
              "variant": "default"
            },
            {
              "time": "13:30 Operating room",